{
    "created": "2024-03-06T16:05:31.448953+00:00",
    "version": "2.0",
    "name": "local-change",
    "parameters": [
        {
            "name": "area_cycle_duration",
            "value": 120.0,
            "description": "Maximum length of float complete cycle in AREA",
            "meta": {
                "unit": "hours",
                "dtype": "float",
                "techkey": "CONFIG_CycleTime_hours"
            }
        },
        {
            "name": "area_parking_depth",
            "value": 1000.0,
            "description": "Drifting depth in AREA",
            "meta": {
                "unit": "m",
                "dtype": "float",
                "techkey": "CONFIG_ParkPressure_dbar"
            }
        },
        {
            "name": "area_xmax",
            "value": -48.0,
            "description": "AREA Eastern bound",
            "meta": {
                "unit": "deg_longitude",
                "dtype": "float",
                "techkey": ""
            }
        },
        {
            "name": "area_xmin",
            "value": -75.0,
            "description": "AREA Western bound",
            "meta": {
                "unit": "deg_longitude",
                "dtype": "float",
                "techkey": ""
            }
        },
        {
            "name": "area_ymax",
            "value": 45.5,
            "description": "AREA Northern bound",
            "meta": {
                "unit": "deg_latitude",
                "dtype": "float",
                "techkey": ""
            }
        },
        {
            "name": "area_ymin",
            "value": 33.0,
            "description": "AREA Southern bound",
            "meta": {
                "unit": "deg_latitude",
                "dtype": "float",
                "techkey": ""
            }
        },
        {
            "name": "cycle_duration",
            "value": 240.0,
            "description": "Maximum length of float complete cycle",
            "meta": {
                "unit": "hours",
                "dtype": "float",
                "techkey": "CONFIG_CycleTime_hours"
            }
        },
        {
            "name": "life_expectancy",
            "value": 200,
            "description": "Maximum number of completed cycle",
            "meta": {
                "unit": "cycle",
                "dtype": "int",
                "techkey": "CONFIG_MaxCycles_NUMBER"
            }
        },
        {
            "name": "parking_depth",
            "value": 1000.0,
            "description": "Drifting depth",
            "meta": {
                "unit": "m",
                "dtype": "float",
                "techkey": "CONFIG_ParkPressure_dbar"
            }
        },
        {
            "name": "profile_depth",
            "value": 2000.0,
            "description": "Maximum profile depth",
            "meta": {
                "unit": "m",
                "dtype": "float",
                "techkey": "CONFIG_ProfilePressure_dbar"
            }
        },
        {
            "name": "vertical_speed",
            "value": 0.09,
            "description": "Vertical profiling speed",
            "meta": {
                "unit": "m/s",
                "dtype": "float",
                "techkey": ""
            }
        }
    ],
    "$schema": "https://raw.githubusercontent.com/euroargodev/json-schemas-FloatConfiguration/schemas/VF-ArgoFloat-Configuration.json"
}