{
    "created": "2024-03-07T08:44:43.560904+00:00",
    "version": "2.0",
    "name": "default",
    "parameters": [
        {
            "name": "cycle_duration",
            "value": 240.0,
            "description": "Maximum length of float complete cycle",
            "meta": {
                "unit": "hours",
                "dtype": "float",
                "techkey": "CONFIG_CycleTime_hours",
                "$schema": "https://raw.githubusercontent.com/euroargodev/VirtualFleet/json-schemas-FloatConfiguration/schemas/VF-ArgoFloat-Configuration.json#parameter_metadata"
            },
            "$schema": "https://raw.githubusercontent.com/euroargodev/VirtualFleet/json-schemas-FloatConfiguration/schemas/VF-ArgoFloat-Configuration.json#required_parameter"
        },
        {
            "name": "life_expectancy",
            "value": 200,
            "description": "Maximum number of completed cycle",
            "meta": {
                "unit": "cycle",
                "dtype": "int",
                "techkey": "CONFIG_MaxCycles_NUMBER",
                "$schema": "https://raw.githubusercontent.com/euroargodev/VirtualFleet/json-schemas-FloatConfiguration/schemas/VF-ArgoFloat-Configuration.json#parameter_metadata"
            },
            "$schema": "https://raw.githubusercontent.com/euroargodev/VirtualFleet/json-schemas-FloatConfiguration/schemas/VF-ArgoFloat-Configuration.json#required_parameter"
        },
        {
            "name": "parking_depth",
            "value": 1000.0,
            "description": "Drifting depth",
            "meta": {
                "unit": "m",
                "dtype": "float",
                "techkey": "CONFIG_ParkPressure_dbar",
                "$schema": "https://raw.githubusercontent.com/euroargodev/VirtualFleet/json-schemas-FloatConfiguration/schemas/VF-ArgoFloat-Configuration.json#parameter_metadata"
            },
            "$schema": "https://raw.githubusercontent.com/euroargodev/VirtualFleet/json-schemas-FloatConfiguration/schemas/VF-ArgoFloat-Configuration.json#required_parameter"
        },
        {
            "name": "profile_depth",
            "value": 2000.0,
            "description": "Maximum profile depth",
            "meta": {
                "unit": "m",
                "dtype": "float",
                "techkey": "CONFIG_ProfilePressure_dbar",
                "$schema": "https://raw.githubusercontent.com/euroargodev/VirtualFleet/json-schemas-FloatConfiguration/schemas/VF-ArgoFloat-Configuration.json#parameter_metadata"
            },
            "$schema": "https://raw.githubusercontent.com/euroargodev/VirtualFleet/json-schemas-FloatConfiguration/schemas/VF-ArgoFloat-Configuration.json#required_parameter"
        },
        {
            "name": "vertical_speed",
            "value": 0.09,
            "description": "Vertical profiling speed",
            "meta": {
                "unit": "m/s",
                "dtype": "float",
                "techkey": "",
                "$schema": "https://raw.githubusercontent.com/euroargodev/VirtualFleet/json-schemas-FloatConfiguration/schemas/VF-ArgoFloat-Configuration.json#parameter_metadata"
            },
            "$schema": "https://raw.githubusercontent.com/euroargodev/VirtualFleet/json-schemas-FloatConfiguration/schemas/VF-ArgoFloat-Configuration.json#required_parameter"
        }
    ],
    "$schema": "https://raw.githubusercontent.com/euroargodev/VirtualFleet/json-schemas-FloatConfiguration/schemas/VF-ArgoFloat-Configuration.json"
}